{
  "$schema": "http://json-schema.org/draft-07/schema#",
  "title": "LabDef",
  "description": "A lab definition file, e.g. `labs/<name>.json`, or a `lab.json` in your own project.\n\nTwo modes, decided by the machines: with one machine of `role: \"dc\"` the lab is an **AD domain** (`domain` and `netbios` required, users are domain users, the other machines join the domain); with no `dc` it is a **workgroup** (no domain; users are local accounts created on every machine). Any Windows Server may be the DC and any OS a member.",
  "type": "object",
  "required": [
    "machines"
  ],
  "properties": {
    "$schema": {
      "description": "Optional path or URL of the JSON Schema, for editors (ignored by `lab`).",
      "type": [
        "string",
        "null"
      ]
    },
    "name": {
      "description": "The lab's name: names its state folder `labs/state/<name>/` and its VMs. Default: the file name without `.json` (for a lab outside win-test-lab's `labs/`, plus a short hash of its path, so two projects' `lab.json` never share a state).",
      "default": null,
      "type": [
        "string",
        "null"
      ]
    },
    "domain": {
      "description": "AD mode: the forest's DNS name, e.g. `lab.local`. Must be absent in workgroup mode.",
      "default": null,
      "type": [
        "string",
        "null"
      ]
    },
    "netbios": {
      "description": "AD mode: the NetBIOS domain name, e.g. `LAB` (users log on as `LAB\\student`). Must be absent in workgroup mode.",
      "default": null,
      "type": [
        "string",
        "null"
      ]
    },
    "admin_password": {
      "description": "Password of the Administrator: the domain Administrator (and DSRM) in AD mode, each machine's local Administrator in workgroup mode. Default `WinTest!2026` (what the base images are installed with).",
      "default": null,
      "type": [
        "string",
        "null"
      ]
    },
    "network": {
      "description": "The private network between the machines. Required unless the lab is one workgroup machine (which then only has the host's NAT network).",
      "default": null,
      "anyOf": [
        {
          "$ref": "#/definitions/NetworkDef"
        },
        {
          "type": "null"
        }
      ]
    },
    "machines": {
      "description": "The machines, keyed by computer name. At most one has `role: dc` (none = workgroup).",
      "type": "object",
      "additionalProperties": {
        "$ref": "#/definitions/MachineDef"
      }
    },
    "users": {
      "description": "The users: domain users in AD mode (always in Domain Users), local users on every machine in workgroup mode (always in Users). Named groups are created if missing.",
      "default": {},
      "type": "object",
      "additionalProperties": {
        "$ref": "#/definitions/UserDef"
      }
    }
  },
  "additionalProperties": false,
  "definitions": {
    "NetworkDef": {
      "description": "The private VM-to-VM network.",
      "type": "object",
      "required": [
        "lan_port",
        "subnet"
      ],
      "properties": {
        "subnet": {
          "description": "First three octets of the /24, e.g. `10.77.30` (DC gets .10, the others .20, .21, ...).",
          "type": "string"
        },
        "lan_port": {
          "description": "Host loopback UDP port the multicast lab LAN uses (unique per running lab).",
          "type": "integer",
          "format": "uint16",
          "minimum": 0.0
        }
      },
      "additionalProperties": false
    },
    "MachineDef": {
      "description": "One machine in a lab.",
      "type": "object",
      "required": [
        "os"
      ],
      "properties": {
        "os": {
          "description": "OS key from `lib/oslist.conf`, e.g. `2019`, `2012`, `win11`.",
          "type": "string"
        },
        "role": {
          "description": "The compact role alias: `dc` (= `roles: [\"ad-ds\"]`) or `member` (= no roles). Mutually exclusive with `roles`.",
          "default": null,
          "anyOf": [
            {
              "$ref": "#/definitions/RoleAlias"
            },
            {
              "type": "null"
            }
          ]
        },
        "roles": {
          "description": "The server roles this machine runs (see [`LabRole`]): `ad-ds`, `ad-cs`, `dhcp`, `iis`. Mutually exclusive with `role`. Servers only.",
          "default": null,
          "type": [
            "array",
            "null"
          ],
          "items": {
            "$ref": "#/definitions/LabRole"
          }
        },
        "features": {
          "description": "Windows feature names to install during the build (`Install-WindowsFeature`), e.g. `Telnet-Client`. Servers only; an unknown name fails the build with the available list.",
          "default": [],
          "type": "array",
          "items": {
            "type": "string"
          }
        },
        "setup": {
          "description": "Setup scripts run once during the build, in order, after the join/roles/features.",
          "default": [],
          "type": "array",
          "items": {
            "$ref": "#/definitions/SetupDef"
          }
        },
        "ad_cs": {
          "description": "`ad-cs` role options (ignored without the `ad-cs` role).",
          "default": null,
          "anyOf": [
            {
              "$ref": "#/definitions/AdCsDef"
            },
            {
              "type": "null"
            }
          ]
        },
        "dhcp": {
          "description": "`dhcp` role options (ignored without the `dhcp` role).",
          "default": null,
          "anyOf": [
            {
              "$ref": "#/definitions/DhcpDef"
            },
            {
              "type": "null"
            }
          ]
        },
        "iis": {
          "description": "`iis` role options (ignored without the `iis` role).",
          "default": null,
          "anyOf": [
            {
              "$ref": "#/definitions/IisDef"
            },
            {
              "type": "null"
            }
          ]
        },
        "logon": {
          "description": "A user (from `users`) this machine logs on as automatically; without one it logs on as Administrator. The DC cannot set one.",
          "default": null,
          "type": [
            "string",
            "null"
          ]
        },
        "mem": {
          "description": "RAM in MB (default 4096 for a member, 3072 for the DC).",
          "default": null,
          "type": [
            "integer",
            "null"
          ],
          "format": "uint32",
          "minimum": 0.0
        },
        "cpus": {
          "description": "vCPUs (default 2).",
          "default": null,
          "type": [
            "integer",
            "null"
          ],
          "format": "uint32",
          "minimum": 0.0
        },
        "ip": {
          "description": "Static IPv4, either a full `a.b.c.d` or a bare last octet within the subnet. Default: DC `.10`, members `.20`, `.21`, ... in declaration order.",
          "default": null,
          "type": [
            "string",
            "null"
          ]
        }
      },
      "additionalProperties": false
    },
    "RoleAlias": {
      "description": "`role: \"dc\"` / `role: \"member\"` — the compact alias for `roles` (see [`LabRole`]).",
      "oneOf": [
        {
          "description": "same as `roles: [\"ad-ds\"]`",
          "type": "string",
          "enum": [
            "dc"
          ]
        },
        {
          "description": "same as `roles: []`",
          "type": "string",
          "enum": [
            "member"
          ]
        }
      ]
    },
    "LabRole": {
      "description": "A server role baked into the 0 state. A machine lists the roles it runs in `roles`; the old `role: \"dc\"` is an alias for `roles: [\"ad-ds\"]` and `role: \"member\"` for no roles.",
      "oneOf": [
        {
          "description": "Active Directory Domain Services: makes this machine the domain controller (one per AD lab; promotes a new forest). A Windows Server.",
          "type": "string",
          "enum": [
            "ad-ds"
          ]
        },
        {
          "description": "AD Certificate Services: an Enterprise Root CA (needs the domain; installed as a domain admin after the join). A Windows Server.",
          "type": "string",
          "enum": [
            "ad-cs"
          ]
        },
        {
          "description": "DHCP server: a scope for the lab subnet, authorized in AD when there is a domain. A Windows Server.",
          "type": "string",
          "enum": [
            "dhcp"
          ]
        },
        {
          "description": "IIS web server: `Web-Server` + the common features, the default site serving a test page. A Windows Server.",
          "type": "string",
          "enum": [
            "iis"
          ]
        }
      ]
    },
    "SetupDef": {
      "description": "One setup script, run once during the 0-state build (after the join, roles and features).",
      "type": "object",
      "required": [
        "run"
      ],
      "properties": {
        "run": {
          "description": "the script to run, relative to the lab file: `.ps1 .bat .cmd .exe .msi`, e.g. `./setup/configure.ps1`. Staged onto the control disc and run during the build.",
          "type": "string"
        },
        "args": {
          "description": "command-line arguments",
          "default": null,
          "type": [
            "string",
            "null"
          ]
        },
        "as": {
          "description": "who to run it as: `system` (default) or a lab user (a domain user in AD mode)",
          "default": null,
          "type": [
            "string",
            "null"
          ]
        }
      },
      "additionalProperties": false
    },
    "AdCsDef": {
      "description": "`ad_cs` options (an Enterprise Root CA). All optional; see the defaults in [`AdCsOpts`].",
      "type": "object",
      "properties": {
        "ca_name": {
          "description": "the CA's common name (default `<NETBIOS>-ROOT-CA`)",
          "default": null,
          "type": [
            "string",
            "null"
          ]
        },
        "key_length": {
          "description": "the CA key length in bits (default 2048)",
          "default": null,
          "type": [
            "integer",
            "null"
          ],
          "format": "uint32",
          "minimum": 0.0
        },
        "validity_years": {
          "description": "the root certificate's validity in years (default 5)",
          "default": null,
          "type": [
            "integer",
            "null"
          ],
          "format": "uint32",
          "minimum": 0.0
        },
        "autoenroll": {
          "description": "link a domain GPO that turns on computer + user certificate auto-enrollment, and publish the Workstation/User templates enrollable by Domain Computers/Users (default true)",
          "default": null,
          "type": [
            "boolean",
            "null"
          ]
        }
      },
      "additionalProperties": false
    },
    "DhcpDef": {
      "description": "`dhcp` options. See [`DhcpOpts`].",
      "type": "object",
      "properties": {
        "range": {
          "description": "the scope as last octets within the lab subnet, `.<start>-.<end>` (default `.100-.199`); router and DNS are the DC",
          "default": null,
          "type": [
            "string",
            "null"
          ]
        }
      },
      "additionalProperties": false
    },
    "IisDef": {
      "description": "`iis` options. See [`IisOpts`].",
      "type": "object",
      "properties": {
        "site_path": {
          "description": "the default site's physical path (default `C:\\inetpub\\wwwroot`); a test page is written there if one is not present",
          "default": null,
          "type": [
            "string",
            "null"
          ]
        }
      },
      "additionalProperties": false
    },
    "UserDef": {
      "description": "One user (a domain user in AD mode, a local user on every machine in workgroup mode).",
      "type": "object",
      "required": [
        "password"
      ],
      "properties": {
        "password": {
          "type": "string"
        },
        "groups": {
          "description": "Extra groups (domain groups in AD mode, e.g. \"Domain Admins\"; local groups in workgroup mode, e.g. \"Administrators\"). A group that does not exist is created.",
          "default": [],
          "type": "array",
          "items": {
            "type": "string"
          }
        }
      },
      "additionalProperties": false
    }
  }
}
